{
  "case_metadata": {"case_id": "PMF_LIGNIN_TGA_5KMIN","purpose": "Lignin, inert TGA ramp, preserves the source full-yield branch.","evidence_intent": "screening"},
  "feedstock": {"feedstock_id": "RWTH2021_LIGNIN","family": "lignocellulosic_biomass","name": "Extracted lignin — RWTH 2021 benchmark","source_type": "open_benchmark_component","provenance_id": "doi:10.18154/RWTH-2021-05544","proximate_analysis": {"basis": "dry","quality_status": "derived","values": {"volatile_matter": 0.6730352999999999,"fixed_carbon": 0.3139647000000001,"ash": 0.013},"complete_balance": true,"source_ref": "RWTH 2021 Table 1; dry VM derived from daf VM and dry ash","method": "basis conversion only"},"ultimate_analysis": {"basis": "dry_ash_free","quality_status": "measured_secondary_source","values": {"C": 0.6069,"H": 0.0557,"N": 0.0122,"S": 0.0081,"O": 0.3171},"complete_balance": true,"source_ref": "RWTH 2021 Table 1","oxygen_method": "source reported by difference"},"physical_properties": {"particle_dp50_m": 0.0001259}},
  "regime": {"thermal_program": {"type": "linear_ramp","T_initial_K": 303.0,"T_final_K": 1173.0,"heating_rate_K_per_s": 0.08333333333333333},"pressure_Pa": 101325.0,"atmosphere": {"class": "inert","mole_fractions": {"N2": 1.0}}},
  "model_request": {"requested_fidelity": "minimum_sufficient","selection_mode": "auto_evidence_aware","requested_model_id": null},"outputs_requested": ["total_yield"],"validation_context": {"benchmark_id": "B1","component": "lignin","source_doi": "10.18154/RWTH-2021-05544"}
}