{
  "case_metadata": {"case_id": "PMF_HEMICELLULOSE_TGA_5KMIN","purpose": "Hemicellulose, inert TGA ramp, exercises a second component parameterization.","evidence_intent": "screening"},
  "feedstock": {"feedstock_id": "RWTH2021_HEMICELLULOSE","family": "lignocellulosic_biomass","name": "Extracted hemicellulose — RWTH 2021 benchmark","source_type": "open_benchmark_component","provenance_id": "doi:10.18154/RWTH-2021-05544","proximate_analysis": {"basis": "dry","quality_status": "derived","values": {"volatile_matter": 0.746074,"fixed_carbon": 0.23392599999999997,"ash": 0.02},"complete_balance": true,"source_ref": "RWTH 2021 Table 1; dry VM derived from daf VM and dry ash","method": "basis conversion only"},"ultimate_analysis": {"basis": "dry_ash_free","quality_status": "measured_secondary_source","values": {"C": 0.4112,"H": 0.0623,"N": 0.0021,"S": 0.001,"O": 0.5234},"complete_balance": true,"source_ref": "RWTH 2021 Table 1","oxygen_method": "source reported by difference"},"physical_properties": {"particle_dp50_m": 9.37e-05}},
  "regime": {"thermal_program": {"type": "linear_ramp","T_initial_K": 303.0,"T_final_K": 1173.0,"heating_rate_K_per_s": 0.08333333333333333},"pressure_Pa": 101325.0,"atmosphere": {"class": "inert","mole_fractions": {"N2": 1.0}}},
  "model_request": {"requested_fidelity": "minimum_sufficient","selection_mode": "auto_evidence_aware","requested_model_id": null},"outputs_requested": ["total_yield"],"validation_context": {"benchmark_id": "B1","component": "hemicellulose","source_doi": "10.18154/RWTH-2021-05544"}
}